"article_ID","article_title","keyword_ID","keyword"
"1185","The Epidemic Theory of Ghettos and Neighborhood Effects on Dropping Out and Teenage Childbearing","21","Theory"
"1196","Network Topologies and Virtual Place","28","Network"
"1213","The Psychology of Social Impact","30","Impact"
"1220","Spatial Choice and Constraints on Behavior","39","Behavior"
"1232","Threshold Models of Collective Behavior","39","Behavior"
"1240","[book]Social Network Analysis: Methods and Applications","28","Network"
"1249","Estimates and 25-year trends of the global burden of disease attributable to ambient air pollution: an analysis of data from the Global Burden of Diseases Study 2015.","63","Health"
"1260","Particulate Matter Air Pollution and the Risk of Incident CKD and Progression to ESRD","43","Risk"
"1262","Regulation of fine particulate matter (PM2.5) in the Pacific Rim: perspectives from the APRU Global Health Program","63","Health"
"1276","Estimating the Health Cost of Air Pollution: The Case of Morocco","63","Health"
"1287","Characterization of Fine Particulate Matter and Associated Health Burden in Nanjing","63","Health"
"1291","Relationship between chemical composition and oxidative potential of secondary organic aerosol from polycyclic aromatic hydrocarbons","24","Relationship"
"1294","Building Healthy Community Environments: A Public Health Approach","63","Health"
"1323","Developing a Clinical Approach to Air Pollution and Cardiovascular Health","63","Health"
"1334","Effects of the Ambient Fine Particulate Matter on Public Awareness of Lung Cancer Risk in China: Evidence from the Internet-Based Big Data Platform","43","Risk"
"1334","Effects of the Ambient Fine Particulate Matter on Public Awareness of Lung Cancer Risk in China: Evidence from the Internet-Based Big Data Platform","76","Data"
"1334","Effects of the Ambient Fine Particulate Matter on Public Awareness of Lung Cancer Risk in China: Evidence from the Internet-Based Big Data Platform","19","Platform"
"1339","Towards Personal Exposures: How Technology Is Changing Air Pollution and Health Research","63","Health"
"1351","Urban Form, Air Pollution, and Health","63","Health"
"1356","The effects of PM2.5 on asthmatic and allergic diseases or symptoms in preschool children of six Chinese cities, based on China, Children, Homes and Health (CCHH) project","63","Health"
"1361","Effects of Leisure‐Time and Transport‐Related Physical Activities on the Risk of Incident and Recurrent Myocardial Infarction and Interaction With Traffic‐Related Air Pollution: A Cohort Study","43","Risk"
"1374","Ambient air pollution in relation to diabetes and glucose-homoeostasis markers in China: a cross-sectional study with findings from the 33 Communities Chinese Health Study","63","Health"
"1375","Health Impacts of Ambient Air Pollution in Finland","63","Health"
"1377","Land Use Regression Models for Alkylbenzenes in a Middle Eastern Megacity: Tehran Study of Exposure Prediction for Environmental Health Research (Tehran SEPEHR)","63","Health"
"1387","Long-term exposure to ambient air pollution (including PM 1 ) and metabolic syndrome: The 33 Communities Chinese Health Study (33CCHS)","63","Health"
"1394","Sensitivities of Simulated Source Contributions and Health Impacts of PM2.5 to Aerosol Models","63","Health"
"1398","Exposure to Ambient Fine Particulate Air Pollution in Utero as a Risk Factor for Child Stunting in Bangladesh","43","Risk"
"1399","Health Impact of PM10, PM2.5 and Black Carbon Exposure Due to Different Source Sectors in Stockholm, Gothenburg and Umea, Sweden","63","Health"
"1399","Health Impact of PM10, PM2.5 and Black Carbon Exposure Due to Different Source Sectors in Stockholm, Gothenburg and Umea, Sweden","30","Impact"
"1405","Investigating Everyday Information Behavior of Using Ambient Displays: A Case of Indoor Air Quality Monitors","59","Information"
"1405","Investigating Everyday Information Behavior of Using Ambient Displays: A Case of Indoor Air Quality Monitors","39","Behavior"
"1406","Research on the Topological Properties of Air Quality Index Based on a Complex Network","28","Network"
"1407","Impact of the financial crisis on COPD burden: Greece as a case study","30","Impact"
"1416","Stringent Emission Control Policies Can Provide Large Improvements in Air Quality and Public Health in India","63","Health"
"1424","Winter haze over North China Plain from 2009 to 2016: Influence of emission and meteorology","31","Influence"
"1425","Influence of natural ventilation rate on indoor PM2.5 deposition","31","Influence"
"1427","Impact of air pollution control policies on future PM2.5 concentrations and their source contributions in China","30","Impact"
"1428","Divining the Future of Air Pollution in China: Huge Gains in Health Can Be Achieved, but Much Work Remains","63","Health"
"1429","Spatiotemporal Assessment of PM2.5-Related Economic Losses from Health Impacts during 2014–2016 in China","63","Health"
"1434","Premature Deaths Attributable to Exposure to Ambient Fine Particulate Matter in the Republic of Korea: Implication for Future Environmental Health","63","Health"
"1442","A Comparison of the Health Effects of Ambient Particulate Matter Air Pollution from Five Emission Sources","63","Health"
"1443","Health impact of China's Air Pollution Prevention and Control Action Plan: an analysis of national air quality monitoring and mortality data","63","Health"
"1449","POLLAR: Impact of air POLLution on Asthma and Rhinitis; a European Institute of Innovation and Technology Health (EIT Health) project","30","Impact"
"1449","POLLAR: Impact of air POLLution on Asthma and Rhinitis; a European Institute of Innovation and Technology Health (EIT Health) project","63","Health"
"1456","Health and economic benefits of building ventilation interventions for reducing indoor PM2.5 exposure from both indoor and outdoor origins in urban Beijing, China","63","Health"
"1465","The Impact of Air Pollution on Our Epigenome: How Far Is the Evidence? (A Systematic Review)","30","Impact"
"1475","Impacts of Climate Change on Health and Wellbeing in South Africa","63","Health"
"1476","Spatiotemporal description of BTEX volatile organic compounds in a Middle Eastern megacity : Tehran Study of Exposure Prediction for Environmental Health Research (Tehran SEPEHR)","63","Health"
"1483","Impact of climate and air pollution on acute coronary syndromes: an update from the European Society of Cardiology Congress 2017","30","Impact"
"1489","Interactions of Climate Change, Air Pollution, and Human Health","63","Health"
"1490","Towards the Integrated Study of Urban Climate, Air Pollution, and Public Health","63","Health"
"1491","Long‐Term Effects of Ambient Particulate Matter (With an Aerodynamic Diameter ≤2.5 μm) on Hypertension and Blood Pressure and Attributable Risk Among Reproductive‐Age Adults in China","43","Risk"
"1497","Relationship of Time-Activity-Adjusted Particle Number Concentration with Blood Pressure","24","Relationship"
"1506","Maternal Exposure to Ambient Particulate Matter ≤2.5 µm During Pregnancy and the Risk for High Blood Pressure in Childhood","43","Risk"
"1522","Aerosol Health Effects from Molecular to Global Scales","63","Health"
"1542","Research Needs on Respiratory Health in Migrant and Refugee Populations. An Official American Thoracic Society and European Respiratory Society Workshop Report","63","Health"
"1544","Air Quality Monitoring Network Design Optimisation for Robust Land Use Regression Models","28","Network"
"1548","The Canadian Urban Environmental Health Research Consortium – a protocol for building a national environmental exposure data platform for integrated analyses of urban form and health","63","Health"
"1549","Influence of urban and transport planning and the city environment on cardiovascular disease","31","Influence"
"1555","Impact of hypertension on health-related quality of life among different age subgroups in Shanghai: the subpopulation treatment effect pattern plot analysis","30","Impact"
"1557","International Changes in Environmental Conditions and Their Personal Health Consequences","63","Health"
"1566","Differential Susceptibility in Ambient Particle–Related Risk of First-Ever Stroke: Findings From a National Case-Crossover Study","43","Risk"
"1576","A Narrative Review on the Human Health Effects of Ambient Air Pollution in Sub-Saharan Africa: An Urgent Need for Health Effects Studies","63","Health"
"1577","Health impact assessment of PM2.5-related mitigation scenarios using local risk coefficient estimates in 9 Japanese cities","63","Health"
"1579","An Integrated Risk Function for Estimating the Global Burden of Disease Attributable to Ambient Fine Particulate Matter Exposure","43","Risk"
"1589","A Relationship Hierarchy Structural Fuzzy ANP model to explore development of marketing strategic alliances","24","Relationship"
"1594","Chaos theory in Strategy Research","15","Strategy"
"1602","The Cybernetic Theory of Decision","21","Theory"
"1618","Prospect Theory: An Analysis of Decision Under Risk","43","Risk"
"1619","Superstitious Learning with Rare Strategic Decisions: Theory and Evidence from Corporate Acquisitions","21","Theory"
"1620","[book]Managing Network Resources: Alliances, Affiliations, and Other Relational Assets","28","Network"
"1621","[book]A Behavioral Theory of the Firm","21","Theory"
"1633","Toward a Comprehensive Theory of Collaboration","21","Theory"
"1656","Impact of age-0 bluefish (Pomatomus saltatrix) predation on age-0 fishes in the Hudson River estuary: evidence for density-dependent loss of juvenile striped bass (Morone saxatilis)","30","Impact"
"1658","Digital signal restoration using projection and fuzzy set techniques","68","Digital"
"1678","Estimating the Basic Reproductive Number from Viral Sequence Data","76","Data"
"1700","Comparative Signature Diagrams to Evaluate Biophysical Data for Differences in Protein Structure Across Various Formulations","76","Data"
"1707","Effective Sample Size in Order Statistics of Correlated Data","76","Data"
"1724","A Latent Health Factor Model for Estimating Estuarine Ecosystem Health","63","Health"
"1754","Probabilistic Methods for Financial and Marketing Informatics","16","Marketing"
"1755","The Impact of Size on Health Care Insurance Company Success","30","Impact"
"1755","The Impact of Size on Health Care Insurance Company Success","63","Health"
"1756","Bayesian Estimation of a Continuous-Time Model for Discretely-Observed Panel Data","76","Data"
"1762","Relationship of takeover gains to the stake of managers in the acquiring firm","24","Relationship"
"1867","Modelling the Absolute Returns of Different Stock Indices: Exploring the Forecastability of an Alternative Measure of Risk","43","Risk"
"1884","Possibility-Based Design Optimization Method for Design Problems With Both Statistical and Fuzzy Input Data","76","Data"
"1886","RAPID COMMUNICATION Comparative Signature Diagrams to Evaluate Biophysical Data for Differences in Protein Structure Across Various Formulations","76","Data"
"1908","Information markets for product attributes: A game theoretic, dual pricing mechanism","59","Information"
"1933","A Study on the Risk Identification Methods for Initial and Mass Production Stage of Military Products Using FMEA","43","Risk"
"1940","Construction Risk Analysis Tool for Determining Liquidated Damages Insurance Premiums: Case Study","43","Risk"
"1956","Combining Behavior Models to Secure Email Systems","39","Behavior"
"1988","Multichannel Analyzer Data Analysis by a Least Squares Computer Program","76","Data"
"1992","Chromosome Aberrations Produced by Radiation: The Relationship between Excess Acentric Fragments and Dicentrics","24","Relationship"
"1994","Uses of the Buys-Ballot Table in Time Series Analysis","48","Uses"
"1997","Dairy Operation Management Practices and Herd Milk Production","25","Management"
"2007","The Sampling Relationship Between Sharpe's Performance Measure and its Risk Proxy: Sample Size, Investment Horizon and Market Conditions","24","Relationship"
"2007","The Sampling Relationship Between Sharpe's Performance Measure and its Risk Proxy: Sample Size, Investment Horizon and Market Conditions","43","Risk"
"2008","Detecting Viral Propagations Using Email Behavior Profiles","39","Behavior"
"2009","Demand-Side Theory and Congressional Committee Composition: A Constituency Characteristics Approach","21","Theory"
"2025","A Power Management Proxy with a New Best-of-N Bloom Filter Design to Reduce False Positives","25","Management"
"2053","Theory and practice of acoustic confusability","21","Theory"
"2058","Influence of Fabrication Error on the Characteristics of a 2-D Photonic-Crystal Cavity","31","Influence"
"2059","On the Theory of Random Noise. Phenomenological Models. I","21","Theory"
"2060","Multi-Commodity Real Options Analysis of Power Plant Investments: Discounting Endogenous Risk Structures","43","Risk"
"2074","Theory of Statistics","21","Theory"
"2075","Mining models of exceptional objects through rule learning","61","Mining"
"2076","Impact of selected policy and market factors upon student flows from high school to competing destinations","30","Impact"
"2077","Methods for the Analysis of CCRC Data","76","Data"
"2097","Information in channel-coded systems: correlated receivers","59","Information"
"2098","Determination of Optimal Initial Weights of an Artificial Neural Network by Using the Harmony Search Algorithm: Application to Breakwater Armor Stones","28","Network"
"2102","An RFID Encoding Method for Supply Chain Management","25","Management"
"2142","Single Molecule Data Analysis: An Introduction","76","Data"
"2146","Bayesian Inference for NASA Probabilistic Risk and Reliability Analysis","43","Risk"
"2156","Interferometric Processing of SAR Data","76","Data"
"2157","t-Statistics for Weighted Means in Credit Risk Modelling","43","Risk"
"2167","Information and Capital Asset Pricing","59","Information"
"2173","Characterization of Transverse Cracking Spatial Variability Using LTPP Data for CRCP Design","76","Data"
"2211","Neural Network Support Vector Detection via a Soft-Label, Hybrid K-Means Classifier","28","Network"
"2213","Comparison of Different Confidence Intervals of Intensities for an Open Queueing Network with Feedback","28","Network"
"2217","Search Theory and Mate Choice. I. Models of Single-Sex Discrimination","21","Theory"
"2247","Negative Exponential Distribution Traffic Pattern for Power/Performance Analysis of Network on Chips","28","Network"
"2249","Modern Robust Data Analysis Methods: Measures of Central Tendency","76","Data"
"2261","Theory of Convection in a Deep Rotating Spherical Shell, and Its Application to the Sun","21","Theory"
"2274","Scalable Feature Selection in High-Dimensional Data Based on GRASP","76","Data"
"2277","Swap Credit Risk: An Empirical Investigation on Transaction Data","76","Data"
"2280","Non-Parametric and Semi-Parametric Techniques for Modeling and Simulating Correlated, Non-Normal Price and Yield Distributions: Applications to Risk Analysis in Kansas Agriculture","43","Risk"
"2284","Structured, Focused Uncertainty: Information Analysis for Multi-Method Comparative Case Studies","59","Information"
"2319","A Comparison of Information Functions and Search Strategies for Sensor Planning in Target Classification","59","Information"
"2364","Culture as Consensus: A Theory of Culture and Informant Accuracy","21","Theory"
"2368","Bias in Pert Project Completion Time Calculations for a Real Network","28","Network"
"2402","Fisher Information Properties","59","Information"
"2404","Analysis of the Network Gains of SISO and MISO Single Frequency Network Broadcast Systems","28","Network"
"2418","Reducing Uncertainty: Information Analysis for Comparative Case Studies","59","Information"
"2426","I Can Has Cheezburger? A Nonparanormal Approach to Combining Textual and Visual Information for Predicting and Generating Popular Meme Descriptions","59","Information"
"2427","Theory and Analysis of Threshold Characters","21","Theory"
"2430","The Probability Of Finding The Data Generation Process After A t2-Testing Sequential Procedure","76","Data"
"2459","Direct Sale of Information when Precision is Unobservable","59","Information"
"2471","The Application of Forecasting Techniques to Modeling Emergency Medical System Calls in Calgary, Alberta","70","Medical"
"2477","A Generic Bayesian Framework for Real-Time Prognostics and Health Management (PHM)","63","Health"
"2477","A Generic Bayesian Framework for Real-Time Prognostics and Health Management (PHM)","25","Management"
"2480","The Relationship between Tsallis Statistics, the Fourier Transform, and Nonlinear Coupling","24","Relationship"
"2494","Arbitrage Pricing with Estimation Risk","43","Risk"
"2502","Application of a General Risk Management Model to Portfolio Optimization Problems with Elliptical Distributed Returns for Risk Neutral and Risk Averse Decision Makers","43","Risk"
"2502","Application of a General Risk Management Model to Portfolio Optimization Problems with Elliptical Distributed Returns for Risk Neutral and Risk Averse Decision Makers","25","Management"
"2508","Learning, Public Good Provision, and the Information Trap","59","Information"
"2532","Combinatorial Information Theory: I. Philosophical Basis of Cross-Entropy and Entropy","59","Information"
"2557","Investigation of the Influence of Overvoltage, Auxiliary Glow Current and Relaxation Time on the Electrical Breakdown Time Delay Distributions in Neon","31","Influence"
"2560","The Most Powerful Tests for Fuzzy Hypotheses Testing with Vague Data","76","Data"
"2570","B. P. CARLIN & T. A. LOUIS (2008) Bayesian Methods for Data Analysis, third edition.","76","Data"
"2597","Software Error as a Limit to Inquiry for Finite Agents: Challenges for the Post-human Scientist","75","Scientist"
"2604","Broadband Data Transport Protocol Designed for Ethernet Services in Metro Ethernet Networks","76","Data"
"2607","Semiparametric Quantile Modelling of Hierarchical Data","76","Data"
"2647","Alpha Inflation? The Impact of Eliminating Scale Items on Cronbach's Alpha","30","Impact"
"2659","Hedges and Trees: Incorporating Fire Risk into Optimal Decisions in Forestry Using a No-Arbitrage Approach","43","Risk"
"2661","Sampling Distribution of the Relative Risk Aversion Estimator: Theory and Applications","43","Risk"
"2661","Sampling Distribution of the Relative Risk Aversion Estimator: Theory and Applications","21","Theory"
"2679","Mining consumer product data via latent semantic indexing","61","Mining"
"2689","An Input–Output Measurable Design for the Security Meter Model to Quantify and Manage Software Security Risk","43","Risk"
"2701","Influence of vessel diameter on red cell distribution at microvascular bifurcations","31","Influence"
"2709","Adequacy of Data for Mining Individual Friendship Pattern from Cellular Phone Call Logs","76","Data"
"2709","Adequacy of Data for Mining Individual Friendship Pattern from Cellular Phone Call Logs","61","Mining"
"2720","A Consensus Model for Electroencephalogram Data Via the S-Transform","76","Data"
"2725","Fisher Information for a partially observable simple birth process","59","Information"
"2726","Total ozone/UVB monitoring and forecasting: Impact of clouds and the horizontal resolution of satellite retrievals","30","Impact"
"2737","Estimation Approaches of Mean Response Time for a Two Stage Open Queueing Network Model","28","Network"
"2745","Exponential Utility Theory Ratemaking: An Alternative Ratemaking Approach","21","Theory"
"2753","Portfolio Selection Problem with Minimax Type Risk Function","43","Risk"
"2792","Statistical Modeling to Information Retrieval for Searching from Big Text Data and Higher Order Inference for Reliability","59","Information"
"2792","Statistical Modeling to Information Retrieval for Searching from Big Text Data and Higher Order Inference for Reliability","76","Data"
"2793","Information provision in financial markets","59","Information"
"2802","Risk and the National Industrial Recovery Act: An Empirical Evaluation","43","Risk"
"2804","Management practices associated with high mortality among preweaned dairy heifers","25","Management"
"2813","Likelihood and Quadratic Distance Methods for the Generalized Asymmetric Laplace Distribution for Financial Data","76","Data"
"2819","A Title 40 Code of Federal Regulations Part 191 Evaluation of Buried Transuranic Waste at the Nevada Test Site","17","Site"
"2820","Applications of Bayesian Decision Theory to Sequential Mastery Testing.","21","Theory"
"2833","Nursing Home Care Quality: Insights From a Bayesian Network Approach","28","Network"
"2855","Patterns of Diagnosed Mathematical Content and Process Skills in TIMSS-R Across a Sample of 20 Countries","14","Content"
"2856","An Empirical Test of the OPM Based on EOE-Transactions Data","76","Data"
"2858","How Do Delay Announcements Shape Customer Behavior? An Empirical Study","23","Customer"
"2861","Optimal Positioning of Service Units Along a Coordinate Line","53","Service"
"2878","A Method for Data Evaluation with Lognormal Distributions","76","Data"
"2884","Regional Modeling of Climate Change Impact on Peninsular Malaysia Water Resources","30","Impact"
"2885","Mining mass spectra for diagnosis and biomarker discovery of cerebral accidents","61","Mining"
"2894","Mathematical Foundations of Sensor Network Design Based On Linguistic Informatics","28","Network"
"2901","Mining uncertain data with probabilistic guarantees","61","Mining"
"2905","Clustering Time-Series Gene Expression Data with Unequal Time Intervals","76","Data"
"2925","Parameter Uncertainty and Residual Estimation Risk","43","Risk"
"2926","Multi-Carrier Based Cooperative Cognitive Network","28","Network"
"2940","Influence of traffic variations on exposure to wireless signals in realistic environments.","31","Influence"
"2941","Domain-Specific Information Retrieval Based on Improved Language Model","59","Information"
"2948","Bending the Power Law: A CMPL Theory of Strategy Shifts and the Automatization of Cognitive Skills","21","Theory"
"2948","Bending the Power Law: A CMPL Theory of Strategy Shifts and the Automatization of Cognitive Skills","15","Strategy"
"2959","Mining statistically significant connected subgraphs in vertex labeled graphs","61","Mining"
"3005","A Two-Part Mixture Model for Longitudinal Adverse Event Severity Data","76","Data"
"3018","Risk Policy and Long-Term Investment","43","Risk"
"3020","Information in a Two-Stage Adaptive Optimal Design","59","Information"
"3088","A Method for Investigating Relative Timing Information on Phylogenetic Trees","59","Information"
"3097","Calibrated Confidence Intervals for Intensities of a Two Stage Open Queueing Network","28","Network"
"3107","Efficiency Measurement of Container Terminals with DEA using an Input Variable of Information Level","59","Information"
"3108","Method of Best Representation for Averages in Data Evaluation","76","Data"
"3109","The Effect of Government Advertising Policies on the Market Power of Cigarette Firms","67","Government"
"3124","Influence of Various Business Regulations on the Amount of Foreign Direct Investments","31","Influence"
"3139","Data needs and spatial structure considerations in stock assessments with regional differences in recruitment and exploitation","76","Data"
"3146","HRR Radar Signature Database Validation for ATR: An Information Theoretic Approach","59","Information"
"3153","Theory and Practice for the use of Cut-Scores for Personnel Decisions","21","Theory"
"3153","Theory and Practice for the use of Cut-Scores for Personnel Decisions","22","Practice"
"3179","What's trending?: mining topical trends in UGC systems with YouTube as a case study","6","YouTube"
"3197","A Simple Model for Valuing Default Swaps when both Market and Credit Risk are Correlated","43","Risk"
"3216","Are Stock Markets Really Like Beauty Contests? Empirical Evidence of Higher Order Belief's Impact on Asset Prices","65","Like"
"3216","Are Stock Markets Really Like Beauty Contests? Empirical Evidence of Higher Order Belief's Impact on Asset Prices","30","Impact"
"3233","The Use and Abuse of 'Real-Time' Data in Economic Forecasting","76","Data"
"3240","The effect of export tax rebates on export performance: Theory and evidence from China","21","Theory"
"3264","Interactions between Agricultural and Resource Policy: Taking into account Downside Risk Aversion","43","Risk"
"3273","Digital chaotic communications","68","Digital"
"3281","On the Basel Accord’s Inverse Relationship between Default Probability and Asset Correlation:An Empirical Study","24","Relationship"
"3291","Inference for Discrete Time Stochastic Processes using Aggregated Survey Data","76","Data"
"3299","Accuracy and Precision of Insect Density and Impact Estimates","30","Impact"
"3304","The Impact of Depositor Preference Laws","30","Impact"
"3307","Some Effects of Differing Information Processing Strategies on Husband-Wife Joint Decisions","59","Information"
"3362","Better Articulating Normal Curve Theory for Introductory Mathematical Statistics Students: Power Transformations and Their Back-Transformations","21","Theory"
"3364","Impact of Three-Parameter Weibull Models in Probabilistic Assessment of Earthquake Hazards","30","Impact"
"3366","Platform Independent Timing of Java Virtual Machine Bytecode Instructions","19","Platform"
"3369","Extrema Propagation: Fast Distributed Estimation of Sums and Network Sizes","28","Network"
"3396","Generic Probability Density Function Reconstruction for Randomization in Privacy-Preserving Data Mining","76","Data"
"3396","Generic Probability Density Function Reconstruction for Randomization in Privacy-Preserving Data Mining","61","Mining"
"3402","Influence of Storage Days on the Distribution for Time of Embryonic Mortality During Incubation","31","Influence"
"3405","Toward a Positive Economic Theory of Hedging","21","Theory"
"3426","Data fusion for automated non-destructive inspection","76","Data"
