"article_ID","article_title","keyword_ID","keyword"
"3434","Assessing the Impact of Travel Path Choice on London's Rail Network Using an Automatic Fare Collection System","30","Impact"
"3434","Assessing the Impact of Travel Path Choice on London's Rail Network Using an Automatic Fare Collection System","28","Network"
"3443","Multiscale Strategies for Solving Water Resources Management Problems with Genetic Algorithms","25","Management"
"3457","VAR Estimation and Forecasting When Data Are Subject to Revision","76","Data"
"3458","On the Estimation of the Correlation Coefficient from Grouped Data","76","Data"
"3459","Priority and Choice Probability Estimation by Ranking, Rating and Combined Data","76","Data"
"3471","Rate-Adaptive Information Transmission over MIMO Channels","59","Information"
"3480","The Incidence of Risk under Credit Insurance","43","Risk"
"3489","Some Estimation Approaches of Intensities for a Two Stage Open Queueing Network","28","Network"
"3506","A Bayesian Examination of Information and Uncertainty in Contingent Valuation","59","Information"
"3508","Comments on the Analysis of Variance Strategy for the Computation of Intraclass Reliability.","15","Strategy"
"3519","Impact of random channel mismatch on the SNR and SFDR of time-interleaved ADCs","30","Impact"
"3532","A Scoring Function for Learning Bayesian Networks based on Mutual Information and Conditional Independence Tests","59","Information"
"3554","Correcting Measures of Relationship between Aggregate-Level Variables for Both Unreliability and Correlated Errors: An Empirical Example ☆ ☆☆","24","Relationship"
"3567","Data Mining at the Interface of Computer Science and Statistics","76","Data"
"3567","Data Mining at the Interface of Computer Science and Statistics","61","Mining"
"3572","Vietnamese Oral Health Beliefs and Practices: Impact on the Utilization of Western Preventive Oral Health Care","63","Health"
"3572","Vietnamese Oral Health Beliefs and Practices: Impact on the Utilization of Western Preventive Oral Health Care","30","Impact"
"3580","Management and nutritional factors associated with the detection of Salmonella sp. from cattle fecal specimens from feedlot operations in the United States","25","Management"
"3586","Estimation and Test of Parameters for Two 0-1 Populations with Partially Missing Data","76","Data"
"3642","Analyzing Empirical Data in Requirements Engineering Techniques","76","Data"
"3649","Iterative Computing over a Unified Relationship Matrix for Information Integration","24","Relationship"
"3649","Iterative Computing over a Unified Relationship Matrix for Information Integration","59","Information"
"3661","Behrens-Fisher Analogs for Discrete and Survival Data","76","Data"
"3668","Business Intelligence: Data Mining and Optimization for Decision Making","76","Data"
"3668","Business Intelligence: Data Mining and Optimization for Decision Making","61","Mining"
"3670","Social Sensing: Building Reliable Systems on Unreliable Data","76","Data"
"3674","Vision-Based Observation Models for Lower Limb 3D Tracking with a Moving Platform","19","Platform"
"3678","Novel Algorithms CIPFP for Mining Frequent Patterns using Counting Inference from Probabilistic Databases and Future Possibilities","61","Mining"
"3713","Mining Projected Clusters in High-Dimensional Spaces","61","Mining"
"3716","Nonparametric Approach to the Analysis of 1-D Warranty Data","76","Data"
"3731","Sequential Probability Ratio Test for Fuzzy Hypotheses Testing with Vague Data","76","Data"
"3742","Monitoring Employee Performance in Service Operations","53","Service"
"3761","A Neural Network Anomaly Detector Using the Random Cluster Model","28","Network"
"3768","Less Strain Energy despite Fewer Misfit Dislocations: The Impact of Ordering","30","Impact"
"3790","Behavior profiling of email","39","Behavior"
"3792","An Evolutionary Bootstrap Approach to Neural Network Pruning and Generalization","28","Network"
"3799","The Impact of Technical Analysis on Asset Price Dynamics","30","Impact"
"3801","Data mining in a nutshell","76","Data"
"3825","A Theory for the Storage and Retrieval of Item and Associative Information.","21","Theory"
"3827","Modeling Multilevel Data Structures","76","Data"
"3834","Wordrank: A Method for Ranking Web Pages Based on Content Similarity","14","Content"
"3847","The leap from ROI to SROI: Farther than expected?☆","41","ROI"
"3850","Credit Risk and Corporate Governance","43","Risk"
"3854","Leveraging Extreme Value Theory","21","Theory"
"3866","Fingerprint for Network Topologies","28","Network"
"3885","A Survey of Computational Methods Used in Microarray Data Interpretation","76","Data"
"3904","The Impact of Weather Conditions on Culex pipiens and Culex restuans (Diptera: Culicidae) Abundance: A Case Study in Peel Region","30","Impact"
"3923","Optimal Payout Ratio under Uncertainty and the Flexibility Hypothesis: Theory and Empirical Evidence","21","Theory"
"3927","Transformed Social Interaction, Augmented Gaze, and Social Influence in Immersive Virtual Environments","31","Influence"
"3931","Optimization Theory for n-Set Functions","21","Theory"
"3941","Intelligent Approach to MPPT Control Strategy for Variable-SpeedWind Turbine Generation System","15","Strategy"
"3943","A Parameterized Probabilistic Model of Network Evolution for Supervised Link Prediction","28","Network"
"3953","Quantitative Methods for Estimating the Reliability of Qualitative Data","76","Data"
"3954","Extensions of Bowman's Theory on Managerial Decision-Making","21","Theory"
"3955","Functional Form, Skewness Effect, and the Risk-Return Relationship","24","Relationship"
"3969","Sex-Dependent Depression-Like Behavior Induced by Respiratory Administration of Aluminum Oxide Nanoparticles","39","Behavior"
"3993","Prenatal Exposure to Urban Air Nanoparticles in Mice Causes Altered Neuronal Differentiation and Depression- Like Responses","65","Like"
"4012","Bringing the Individual Back in: A Structural Analysis of the Internal Market for Reputation in Organizations","42","Reputation"
"4013","The Role of Professional Associations in Technology Diffusion","73","Professional"
"4015","Applied Network Analysis: A Methodological Introduction.","28","Network"
"4020","Professional Codes: Why, How, and with What Impact?","73","Professional"
"4022","Being Good or Being Known: An Empirical Examination of the Dimensions, Antecedents, and Consequences of Organizational Reputation","42","Reputation"
"4023","The Social Network Ties of Group Leaders: Implications for Group Performance and Leader Reputation","28","Network"
"4023","The Social Network Ties of Group Leaders: Implications for Group Performance and Leader Reputation","42","Reputation"
"4026","Boundary Spanning Individuals: Their Role in Information Transfer and Their Antecedents","59","Information"
"4030","Flexibility and Fairness: Effects of the Network Form of Organization on Gender Equity in Life Science Careers:","28","Network"
"4033","Homophily and Differential Returns: Sex Differences in Network Structure and Access in an Advertising Firm","28","Network"
"4034","Reward Systems and NSF University Research Centers: The Impact of Tenure on University Scientists' Valuation of Applied and Commercially Relevant Research","30","Impact"
"4036","Men's and Women's Networks: A Study of Interaction Patterns and Influence In an Organization","31","Influence"
"4040","Reputation and Competence in Publicly Funded Science: Estimating the Effects on Research Group Productivity","42","Reputation"
"4041","The Network Structure Of Social Capital","28","Network"
"4043","Boundary-Work and the Demarcation of Science from Non-Science: Strains and Interests in Professional Ideologies of Scientists","73","Professional"
"4044","Influence and Information: An Exploratory Investigation of the Boundary Role Person's Basis of Power","31","Influence"
"4046","Closing The Gap Between Science And Practice: The Need For Professional Leadership","73","Professional"
"4053","Information flow through strong and weak ties in intraorganizational social networks","59","Information"
"4054","Theorizing Change: The Role of Professional Associations in the Transformation of Institutionalized Fields","73","Professional"
"4068","Being in the Right Place: A Structural Analysis of Individual Influence in an Organization","31","Influence"
"4070","[book]Social Capital: A Theory of Social Structure and Action","21","Theory"
"4070","[book]Social Capital: A Theory of Social Structure and Action","42","Reputation"
"4072","A Theory of Evaluation Applied to a University Faculty.","21","Theory"
"4074","The Role of the Researcher An Analysis of Narrative Position in Organization Theory","21","Theory"
"4076","Networks and Organizations: Structure, Form, and Action","28","Network"
"4077","Network Centrality, Power, and Innovation Involvement: Determinants of Technical and Administrative Roles","28","Network"
"4079","Handbook of Theory and Research for the Sociology of Education","21","Theory"
"4081","Professional medical associations: ethical and practical guidelines.","73","Professional"
"4085","Professional service involvement of leadership faculty: An assessment of gender, role, and satisfaction","73","Professional"
"4087","Reconsidering the Impact of Gender Stereotypes on the Advancement of Women in Organizations","30","Impact"
"4091","Network Effects of International Shocks and Spillovers","28","Network"
"4092","Spatio-Temporal Patterns of the International Merger and Acquisition Network","28","Network"
"4096","Isolating the Network Effect of Immigrants on Trade","28","Network"
"4114","Impact of the Topology of Global Macroeconomic Network on the Spreading of Economic Crises","30","Impact"
"4114","Impact of the Topology of Global Macroeconomic Network on the Spreading of Economic Crises","28","Network"
"4118","Understanding corporate coherence: Theory and evidence","21","Theory"
"4119","Topology, Dependency Tests and Estimation Bias in Network Autoregressive Models","28","Network"
"4139","Network effects on international trade","28","Network"
"4140","The Network of Global Corporate Control","28","Network"
"4144","The Impact of a Customs Union between Turkey and the EU on Turkey's Exports to the EU","30","Impact"
"4160","[book]Advanced International Trade: Theory and Evidence","21","Theory"
"4165","The Network Origins of Aggregate Fluctuations","28","Network"
"4169","A Network Analysis of Countries’ Export Flows: Firm Grounds for the Building Blocks of the Economy","28","Network"
"4183","Structure and Evolution of the World Trade Network","28","Network"
"4192","Structure and Dynamics of the Global Economy: Network Analysis of International Trade 1965–1980","28","Network"
"4203","International Political Risk Management: Perspectives, Approaches and Emerging Agendas","47","Political"
"4203","International Political Risk Management: Perspectives, Approaches and Emerging Agendas","43","Risk"
"4211","Earnings Management and Investor Protection: An International Comparison","25","Management"
"4214","Capacity and Competition: Empirical Evidence on UK Panel Data","76","Data"
"4217","Bringing Institutions into Performance Persistence Research: Exploring the Impact of Product, Financial, and Labor Market Institutions","30","Impact"
"4235","Political Instability and Economic Growth","47","Political"
"4240","Political Hazards, Experience and Sequential Entry Strategies: The International Expansion of Japanese Firms, 1980-1998","47","Political"
"4247","The Reaction in Political Economy","47","Political"
"4301","Risk management of hydropower development in China","43","Risk"
"4306","Corporate Governance and Firm Value: The Impact of Corporate Social Responsibility","30","Impact"
"4307","Impact of Quality Corporate Governance on Firm Performance: A Ten Year Perspective","30","Impact"
"4321","Corporate Governance and Risk Management in Developing Market:A Logic Analysis and Proposal","43","Risk"
"4321","Corporate Governance and Risk Management in Developing Market:A Logic Analysis and Proposal","25","Management"
"4322","Analysis on Disclosure and Transparency in Published Accounting Information of Pakistani Listed Companies","59","Information"
"4330","The Impact of Corporate Governance on Firm's Performance: Evidence from Oil and Gas Sector of Pakistan","30","Impact"
"4338","Impact of Corporate Governance Mechanisms on Firm Value Evidence from the Food Industry of Iran","30","Impact"
"4345","The Impact of Environmental, Social and Governance (ESG) Standards on the Value of Cash Holdings: Evidence from Canadian Firms","30","Impact"
"4359","ADRs, Analysts, and Accuracy: Does Cross Listing in the U.S. Improve a Firm's Information Environment and Increase Market Value?","59","Information"
"4366","Risk Sharing and Asset Prices: Evidence from a Natural Experiment","43","Risk"
"4373","On the Pooling of Time Series and Cross Section Data","76","Data"
"4374","The Political Economy of Corporate Governance","47","Political"
"4384","Executive Compensation, Strategic Competition, and Relative Performance Evaluation: Theory and Evidence","21","Theory"
"4389","A Theory of Board Control and Size","21","Theory"
"4391","[book]The Theory of Corporate Finance","21","Theory"
"4393","To Steal or Not to Steal: Firm Attributes, Legal Environment, and Valuation","76","Data"
"4401","International Cross-Listing, Firm Performance, and Top Management Turnover: A Test of the Bonding Hypothesis","25","Management"
"4407","Stock Market Liberalization and the Information Environment","59","Information"
"4416","Estimating the Impact of Time-Invariant Variables on FDI with Fixed Effects","30","Impact"
"4420","Investor Protection and Equity Markets","47","Political"
"4425","Estimating Standard Errors in Finance Panel Data Sets: Comparing Approaches","76","Data"
"4445","THE VALUE OF COST FUNCTIONS FOR POLICYMAKING AND INSTITUTIONAL RESEARCH","76","Data"
"4450","The Impact of Resource Allocation on Graduation Rates","30","Impact"
"4464","Using Data Envelopment Analysis to Improve Estimates of Higher Education Institution's Per-student Education Costs","76","Data"
"4476","Fitting Second‐Order Finite Mixture Models to Data with Many Censored Values Using Maximum Likelihood Estimation","76","Data"
"4489","[book]Statistical Methods for Reliability Data","76","Data"
"4500","Left Partisanship and Top Management Pay in Affluent Capitalist Democracies","25","Management"
"4508","Insider Information and Performance Pay","59","Information"
"4510","Gender Differences in Executive Compensation and Job Mobility","18","Job"
"4515","How Well Does Agency Theory Explain Executive Compensation","21","Theory"
"4522","Executive Compensation: A Survey of Theory and Evidence","21","Theory"
"4523","The Internal Economics of the Firm: Evidence from Personnel Data","76","Data"
"4526","The Theory of Moral Hazard and Unobservable Behaviour: Part I","21","Theory"
"4528","Job Matching and Occupational Choice","18","Job"
"4529","Experimentation and Job Choice","18","Job"
"4531","Intersectoral Labor Mobility and the Growth of the Service Sector","53","Service"
"4536","Executive Compensation and Principal-Agent Theory","21","Theory"
"4546","Empirical Content of a Continuous-Time Principal-Agent Model","14","Content"
"4552","Specific Capital, Mobility, and Wages: Wages Rise with Job Seniority","18","Job"
"4555","Careers in organizations: Theory and evidence","21","Theory"
"4557","Firm‐Size Wage Gaps, Job Responsibility, and Hierarchical Matching","18","Job"
"4565","Are Risk Aversion and Impatience Related to Cognitive Ability","43","Risk"
"4568","The Job as a Concept","18","Job"
"4569","The economics of career concerns, part II: Application to missions and accountability of Government agencies","67","Government"
"4575","Naturally Occurring Preferences and Exogenous Laboratory Experiments: A Case Study of Risk Aversion","43","Risk"
"4578","Gender and Dynamic Agency: Theory and Evidence on the Compensation of Top Executives","21","Theory"
"4583","Production, Information Costs, and Economic Organization","59","Information"
"4588","Eliciting Risk and Time Preferences","43","Risk"
"4589","Job Mobility and the Careers of Young Men","18","Job"
"4590","Are CEOS Really Paid Like Bureaucrats","65","Like"
"4595","Risk Aversion and Incentive Effects","43","Risk"
"4597","Optimal Incentives Under Moral Hazard and Heterogeneous Agents: Evidence from Production Contracts Data","76","Data"
"4599","Risk Aversion, Performance Pay, and the Principal-Agent Problem","43","Risk"
"4601","A Theory of Career Mobility","21","Theory"
"4602","Reputation and imperfect information","42","Reputation"
"4608","Wage Bargaining with On-the-Job Search: Theory and Evidence","21","Theory"
"4610","A Theory of Wage Dynamics","21","Theory"
"4611","Optimal Incentive Contracts in the Presence of Career Concerns: Theory and Evidence","21","Theory"
"4613","Moral Hazard, Adverse Selection and Health Expenditures: A Semiparametric Analysis","63","Health"
"4623","Risk Aversion and Incentive Effects: Comment","43","Risk"
"4625","Firm Size Wage Differentials in Switzerland: Evidence from Job Changers","18","Job"
"4629","The Economics of Career Concerns, Part I: Comparing Information Structures","59","Information"
"4653","Identifying the Natural Flow Regime and the Relationship with Riparian Vegetation for Two Contrasting Western Australian Rivers","24","Relationship"
"4696","Management Compensation Contracts and Merger-Induced Abnormal Returns","25","Management"
"4703","Annual Survey of Economic Theory: The Theory of Monopoly","21","Theory"
"4712","[book]Positive Accounting Theory","21","Theory"
"4721","Does the Composition and Practice of Boards of Directors Bear Any Relationship to the Performance of Their Companies","22","Practice"
"4721","Does the Composition and Practice of Boards of Directors Bear Any Relationship to the Performance of Their Companies","24","Relationship"
"4723","Management and Ownership in the Large Firm","25","Management"
"4727","A Theory of Large Managerial Firms","21","Theory"
"4729","Board Overlap, Seat Accumulation and Share Prices","64","Share"
"4730","Managerial control of voting rights: Financing policies and the market for corporate control","25","Management"
"4731","The Cadbury Committee, Corporate Performance, and Top Management Turnover","25","Management"
"4748","Management ownership and market valuation: An empirical analysis","25","Management"
"4755","The Structure of Ownership and the Theory of the Firm","21","Theory"
"4757","Toward a Theory of Property Rights","21","Theory"
"4760","[book]The Theory of Industrial Organization","21","Theory"
"4761","Outside directors, board independence, and shareholder wealth☆","25","Management"
"4775","Science-Based Risk Assessment for Nontarget Effects of Transgenic Crops","43","Risk"
"4783","Sustainable Pest Management for Cotton Production: A Review","25","Management"
"4802","Presence of Environmental Risk Assessments for LMOs in nature and Future Considerations based on New Biotechnologies","43","Risk"
"4809","Ecological Engineering for Pest Management","25","Management"
"4812","Influence of Transgenic Insecticidal Crops on Non-target insects: Overview from the Data to Date","31","Influence"
"4812","Influence of Transgenic Insecticidal Crops on Non-target insects: Overview from the Data to Date","76","Data"
"4814","Specificity and Combinatorial Effects of Bacillus Thuringiensis Cry Toxins in the Context of GMO Environmental Risk Assessment","43","Risk"
"4824","Synthetic Biology and Genetic Engineering: Parallels in Risk Assessment","43","Risk"
"4830","Impact of Bacillus thuringiensis – insecticides on population dynamics and egg predation of the Colorado potato beetle in North Carolina potato plantings","30","Impact"
"4875","Influence of transgenic Bacillus thuringiensis corn-fed prey on prey preference of immature Chrysoperla carnea (Neuroptera: Chrysopidae)","31","Influence"
"4922","A Framework for Learning Rules from Multiple Instance Data","76","Data"
"4942","Impact of Corporate Governance on Disclosure Quality: Empirical Evidence from Listed Banks in Malaysia","30","Impact"
"4947","The Effects of Bank Mergers on Corporate Information Disclosure","59","Information"
"4951","The Impact of Corporate Governance on the Voluntary Accounting Information Disclosure in Malaysian Listed Banks","30","Impact"
"4951","The Impact of Corporate Governance on the Voluntary Accounting Information Disclosure in Malaysian Listed Banks","59","Information"
"4957","Does Financial Structure Matter for the Information Content of Financial Indicators","59","Information"
"4957","Does Financial Structure Matter for the Information Content of Financial Indicators","14","Content"
"4961","The Impact of Board Characteristics on Corporate Governance and Disclosure Practices of Firms Listed in Indian Stock Exchange","30","Impact"
"4980","The Interest Rate Pass-Through in Austria – Effects of the Financial Crisis","71","Crisis"
"4992","Revisiting the European Asset Management Industry","25","Management"
"4993","The Impact of Labor Unionization on Corporate Overinvestment and Underinvestment","30","Impact"
"4995","The Foundations of Banks' Risk Regulation: A Review of the Literature","43","Risk"
"5003","Impact of a smoking cessation lifestyle intervention on vascular mechanics in young women","30","Impact"
"5024","Efficacy and Cost-Effectiveness of a Minimal Intervention to Prevent Smoking Relapse: Dismantling the Effects of Amount of Content Versus Contact.","14","Content"
"5040","The Health Consequences of Smoking: Nicotine Addiction: A Report of the Surgeon General","63","Health"
"5044","Context and Physical Activity: The Influence of Others","31","Influence"
"5059","Physical Activity and Public Health Updated Recommendation for Adults From the American College of Sports Medicine and the American Heart Association","63","Health"
"5075","Social Network Analysis: Social Network Analysis in the Social and Behavioral Sciences","28","Network"
"5081","The Impact of Social Structure on Economic Outcomes","30","Impact"
"5090","Top Management Team Demography and Corporate Strategic Change","25","Management"
"5104","Takeover Bids, the Free-Rider Problem, and the Theory of the Corporation","21","Theory"
"5105","Cultural Diversity's Impact On Interaction Process and Performance: Comparing Homogeneous and Diverse Task Groups","30","Impact"
"5106","The Influence of Top Management Team Heterogeneity on Firms' Competitive Moves","31","Influence"
"5106","The Influence of Top Management Team Heterogeneity on Firms' Competitive Moves","25","Management"
"5108","Effects of Ethnic Group Cultural Differences on Cooperative and Competitive Behavior On a Group Task","39","Behavior"
"5116","The Effects of International Operations on the Market Value of the Firm: Theory and Evidence","21","Theory"
"5119","The Strength of Weak Ties: A Network Theory Revisited","28","Network"
"5119","The Strength of Weak Ties: A Network Theory Revisited","21","Theory"
"5127","“They Treat Us Like Human Beings”—Experiencing a Therapeutic Sex Offenders Prison: Impact on Prisoners and Staff and Implications for Treatment","65","Like"
"5127","“They Treat Us Like Human Beings”—Experiencing a Therapeutic Sex Offenders Prison: Impact on Prisoners and Staff and Implications for Treatment","30","Impact"
"5142","[book chapter]The Theory of Reasoned Action","21","Theory"
"5172","The Role of Correctional Officers in Multidisciplinary Mental Health Care in Prisons","63","Health"
"5181","Waterpipe tobacco and cigarette smoking: direct comparison of toxicant exposure.","76","Data"
"5195","Promotion of waterpipe tobacco use, its variants and accessories in young adult newspapers: a content analysis of message portrayal","27","Promotion"
"5198","Review Article: Prevalence and Health Effects of Water Pipe (Shisha) Tobacco Smoking","63","Health"
"5199","Hookah's new popularity among US college students: a pilot study of the characteristics of hookah smokers and their Facebook displays.","1","Facebook"
"5200","US Health Policy Related to Hookah Tobacco Smoking","63","Health"
"5211","Hookah Use Among Youth and Young Adults: A Public Health Challenge","63","Health"
"5222","Understanding Attitudes, Beliefs, and Information Seeking Regarding Hookah Smoking in Parents of College Students: An Exploratory Qualitative Pilot Study","59","Information"
"5231","Americans of Arab Descent and Cardiovascular Risk","43","Risk"
"5232","Factors associated with smoking frequency among current waterpipe smokers in the United States: Findings from the National College Health Assessment II","63","Health"
"5237","Adolescents' Perceptions of Health Risks, Social Risks, and Benefits Differ Across Tobacco Products","63","Health"
"5239","Prevalence, Patterns and Correlates of Cigarette Smoking in Male Adolescents in Northern Jordan, and the Influence of Waterpipe Use and Asthma Diagnosis: A Descriptive Cross-Sectional Study","31","Influence"
"5264","Adverse Effects of Cigarette and Noncigarette Smoke Exposure on the Autonomic Nervous System: Mechanisms and Implications for Cardiovascular Risk","43","Risk"
"5279","Urban College Student Self-Report of Hookah Use with Health Care Providers.","63","Health"
"5286","Shisha Smoking and Associated Factors among Medical Students in Malaysia","70","Medical"
"5307","Risk Factors associated with Hookah use","43","Risk"
"5311","Identifying Health-Related Topics on Twitter","2","Twitter"
"5314","Hookah use among U.S. college students: results from the National College Health Assessment II.","63","Health"
"5315","Knowledge and Attitudes toward Hookah Usage among University Students.","20","Usage"
"5317","Sex Differences in Hookah-Related Images Posted on Tumblr: A Content Analysis","14","Content"
"5318","An educational tobacco intervention: Impact of the Health Belief Model on college students","30","Impact"
