"article_ID","article_title","keyword_ID","keyword"
"2","Localization of Knowledge Spillovers and Agglomeration of R&D Activities: Evidence from China's Provincial Data","76","Data"
"19","Stand und Perspektiven des internationalen Innovationsmanagements","25","Management"
"23","Knowledge spillover effects at the sub-regional level: Theory and estimation","21","Theory"
"37","The Influence of University R&D Expenditures on New Business Formations and Employment Growth","31","Influence"
"50","Defining the Relationship Among Founding Resources, Strategies, and Performance in Technology-Intensive New Ventures: Evidence from the Semiconductor Silicon Industry","24","Relationship"
"85","From Service Operational Headquarters to Joint Task Force Capable Headquarters: An Organizational Transition Model","53","Service"
"88","[book]Network Centric Warfare: Developing and Leveraging Information Superiority","59","Information"
"89","Queueing Systems Volume 1 Theory","21","Theory"
"91","War in the Information Age","59","Information"
"123","[book]Principles of Economics","63","Health"
"123","[book]Principles of Economics","31","Influence"
"123","[book]Principles of Economics","21","Theory"
"130","[book]Econometric Analysis of Cross Section and Panel Data","76","Data"
"133","Global Engagement and the Innovation Activities of Firms","40","Engagement"
"135","Links and Impacts: The Influence of Public Research on Industrial R&D","31","Influence"
"150","[book]Discrete Choice Analysis: Theory and Application to Travel Demand","21","Theory"
"155","Financial Development and Innovation in China: Evidence from the Provincial Data","76","Data"
"160","Transitions from Analog to Digital Computing in Electric Power Systems","68","Digital"
"161","A New A-C Network Analyzer","28","Network"
"179","Co-ordination of Fuel Cost and Transmission Loss by Use of the Network Analyzer to Determine Plant Loading Schedules","28","Network"
"197","The M. I. T. Network Analyzer Design and Application to Power System Problems","28","Network"
"224","Face it: Collecting mental health and disaster related data using Facebook vs. personal interview: The case of the 2011 Fukushima nuclear disaster","1","Facebook"
"225","Objective Confirmation of Subjective Measures of Human Well-Being: Evidence from the U.S.A.","43","Risk"
"228","The Impact of Event Scale: Revised","30","Impact"
"232","Mental Health Effects of Hurricane Sandy: Characteristics, Potential Aftermath, and Response","63","Health"
"233","Psychometric properties of the Impact of Event scale-revised","30","Impact"
"238","Policy Responses to Agricultural Biotechnology and Their Impact on African Development","30","Impact"
"260","Assessment of Latent Semantic Analysis (LSA) Text Mining Algorithms for Large Scale Mapping of Patent and Scientific Publication Documents","61","Mining"
"283","The Theory of the Market Economy and the Social Foundations of Innovative Enterprise","21","Theory"
"286","The Principal-Agent Problem in Development Assistance and Its Negative Impact on Local Entrepreneurship in Africa: Time For New Approaches","30","Impact"
"307","Is There a Significant Contribution of Public Sector in Biomedical Research in Japan? A Detailed Analysis of Government and University Patenting, 1991-2002","67","Government"
"318","Historical Perspectives on Contemporary Problems: Organizational Capabilities and Strategy and Structure of Large Pulp and Paper Firms, 1950-1980","15","Strategy"
"338","Publication and Patent Behavior of Academic Researchers: Conflicting, Reinforcing or Merely Co-Existing?","39","Behavior"
"340","Participative Democracy and Voice: Rethinking Community Collaboration Beyond Neutral Structures","76","Data"
"352","Collaborative Public Management and Democracy: Evidence from Western Watershed Partnerships","25","Management"
"367","The Role of Boundary Spanners as the Interorganizational Link in Nonprofit Collaborating","60","Nonprofit"
"369","Critical Theory and Corporate Social Responsibility","21","Theory"
"372","Communicating in a Collaborating Group: A Longitudinal Network Analysis","28","Network"
"375","[book]Managing to Collaborate: The Theory and Practice of Collaborative Advantage","21","Theory"
"375","[book]Managing to Collaborate: The Theory and Practice of Collaborative Advantage","22","Practice"
"380","Muting the Voice of the Local in the Age of the Global: How Communication Practices Compromised Public Participation in India's Allain Dunhangan Environmental Impact Assessment","30","Impact"
"382","Interorganizational Collaboration Explored Through the Bona Fide Network Perspective","28","Network"
"383","[book]Doing Critical Management Research","25","Management"
"383","[book]Doing Critical Management Research","21","Theory"
"383","[book]Doing Critical Management Research","22","Practice"
"385","Engagement as Co-Generative Theorizing","40","Engagement"
"392","Cross-Sector Partnerships to Address Social Issues: Challenges to Theory and Practice","21","Theory"
"392","Cross-Sector Partnerships to Address Social Issues: Challenges to Theory and Practice","22","Practice"
"398","Does One Bad Apple(Juice) Spoil the Bunch? Implicit Attitudes Toward One Product Transfer to Other Products by the Same Brand","50","Brand"
"422","Consumer neuroscience: advances in understanding consumer psychology","52","Consumer"
"432","Consumer Neuroscience: Revealing Meaningful Relationships Between Brain and Consumer Behavior","52","Consumer"
"432","Consumer Neuroscience: Revealing Meaningful Relationships Between Brain and Consumer Behavior","39","Behavior"
"433","How Reliable Are Neuromarketers' Measures of Advertising Effectiveness?: Data from Ongoing Research Holds No Common Truth among Vendors","76","Data"
"439","Health of the Implicit Association Test at Age 3","63","Health"
"448","Is the Implicit Association Test a Valid and Valuable Measure of Implicit Consumer Social Cognition","52","Consumer"
"457","Decoding an Individual's Sensitivity to Pain from the Multivariate Analysis of EEG Data","76","Data"
"459","Consumer Neuroscience: Applications, Challenges, and Possible Solutions","52","Consumer"
"462","Relationship between attitudes and evaluative space : a critical review, with emphasis on the separability of positive and negative substrates","24","Relationship"
"470","Relevance Feedback in Information Retrieval","59","Information"
"481","When Does Ownership Matter? Board Characteristics and Behavior","39","Behavior"
"483","Agency Relationships in Family Firms: Theory and Evidence","21","Theory"
"484","Power in Top Management Teams: Dimensions, Measurement, and Validation","25","Management"
"484","Power in Top Management Teams: Dimensions, Measurement, and Validation","76","Data"
"485","Private Firms and Corporate Governance: An Integrated Economic and Management Perspective","25","Management"
"495","The Impact of Board Composition on Firms’ Critical Decisions: A Meta-Analytic Review","30","Impact"
"499","The Impact of Goal Alignment on Board Existence and Top Management Team Composition: Evidence from Family-Influenced Businesses","30","Impact"
"499","The Impact of Goal Alignment on Board Existence and Top Management Team Composition: Evidence from Family-Influenced Businesses","25","Management"
"511","Corporate Governance: Decades of Dialogue and Data","76","Data"
"517","Agency Problems and the Theory of the Firm","21","Theory"
"525","Stewardship Theory or Agency Theory: CEO Governance and Shareholder Returns","21","Theory"
"528","Entrepreneurship in Medium-Size Companies: Exploring the Effects of Ownership and Governance Systems","76","Data"
"531","Entrepreneurial Risk Taking of Private Family Firms: The Influence of a Nonfamily CEO and the Moderating Effect of CEO Tenure","43","Risk"
"531","Entrepreneurial Risk Taking of Private Family Firms: The Influence of a Nonfamily CEO and the Moderating Effect of CEO Tenure","31","Influence"
"535","A Review of Theory in Family Business Research: The Implications for Corporate Governance","21","Theory"
"541","Performance Pay and Top Management Incentives","25","Management"
"542","Why do Boards Differ? Because Owners Do: Assessing Ownership Impact on Board Composition","30","Impact"
"545","The Development of Family Companies: Management and Ownership Imperatives","25","Management"
"560","Theory of the firm: Managerial behavior, agency costs and ownership structure","21","Theory"
"564","When does ownership matter? Board characteristics and behavior: Ownership and Board Behavior","39","Behavior"
"567","Data based identification and prediction of nonlinear and complex dynamical systems","76","Data"
"580","Investigation on Law and Economics Based on Complex Network and Time Series Analysis","28","Network"
"624","Impact of node dynamics parameters on topology identification of complex dynamical networks","30","Impact"
"644","Identifying the Topology of a Coupled FitzHugh–Nagumo Neurobiological Network via a Pinning Mechanism","28","Network"
"646","Topology Identification and Module–Phase Synchronization of Neural Network With Time Delay","28","Network"
"653","Topology Identification of Complex Network via Chaotic Ant Swarm Algorithm","28","Network"
"666","Weight Identification of a Weighted Bipartite Graph Complex Dynamical Network with Coupling Delay","28","Network"
"672","Synchronization: An Obstacle to Identification of Network Topology","28","Network"
"741","Management innovation","25","Management"
"752","Flexibility as Process Mobility: The Management of Plant Capabilities for Quick Response Manufacturing","25","Management"
"762","Building Theory about Theory Building: What Constitutes a Theoretical Contribution?","21","Theory"
"776","Thick Description: Towards an Interpretive Theory of Culture","21","Theory"
"790","Coal Smoke and the Costs of the Industrial Revolution","69","Revolution"
"808","Urban Resurgence and the Consumer City","52","Consumer"
"830","The Impact of Trade on Intra‐Industry Reallocations and Aggregate Industry Productivity","30","Impact"
"838","Railroads of the Raj: Estimating the Impact of Transportation Infrastructure","30","Impact"
"841","Facebook use, envy, and depression among college students","1","Facebook"
"843","Mother, baby and Facebook makes three: does social media provide social support for new mothers?","1","Facebook"
"846","College students' Facebook posts and locus of control","1","Facebook"
"847","Facebook Paradox? The Effects of Facebooking on Individuals' Social Relationships and Psychological Well-being","1","Facebook"
"848","Reassessing the Facebook Experiment: Critical Thinking About the Validity of Big Data Research","1","Facebook"
"848","Reassessing the Facebook Experiment: Critical Thinking About the Validity of Big Data Research","76","Data"
"853","The role of chronotype on Facebook usage aims and attitudes towards Facebook and its features","1","Facebook"
"857","The Mediating Roles of Upward Social Comparison and Self-esteem and the Moderating Role of Social Comparison Orientation in the Association between Social Networking Site Usage and Subjective Well-Being","17","Site"
"857","The Mediating Roles of Upward Social Comparison and Self-esteem and the Moderating Role of Social Comparison Orientation in the Association between Social Networking Site Usage and Subjective Well-Being","20","Usage"
"858","Self-esteem moderates the influence of self-presentation style on Facebook users’ sense of subjective well-being","1","Facebook"
"860","An Empirical Study of Discontinuous Use Intention on SNS: From a Perspective of Society Comparison Theory","21","Theory"
"861","Researching The Influence of Online Social Networks on The Students’ Communication – 1St Part","31","Influence"
"863","The interplay between Facebook use, social comparison, envy, and depression","1","Facebook"
"867","An Exploratory Study of the Relationship between Social Technology Use and Depression among College Students","24","Relationship"
"875","Understanding the relationship between Facebook use and adaptation to financial hardship: Evidence from a longitudinal panel study","1","Facebook"
"876","An exploration of the link between adult attachment and problematic Facebook use","1","Facebook"
"879","Influence of Personality on Emotional Contagion through Social Media","31","Influence"
"882","Why Do Young People Multitask With Multiple Media? Explicating the Relationships Among Sensation Seeking, Needs, and Media Multitasking Behavior","39","Behavior"
"884","Associations Between Internet-Based Professional Social Networking and Emotional Distress","73","Professional"
"885","Technology Addiction: How Social Network Sites Impact our Lives","28","Network"
"885","Technology Addiction: How Social Network Sites Impact our Lives","30","Impact"
"886","The Relationship Between Online Social Networking and Depression: A Systematic Review of Quantitative Studies","24","Relationship"
"888","Please Stop Rubbing Your Relationship In My Face(book): An Investigation of Online Romantic Social Comparison","24","Relationship"
"890","Pro-social messages and transcendence: A content analysis of Facebook reactions to Mark Zuckerberg's donation pledge","1","Facebook"
"894","Social Comparison as the Thief of Joy: Emotional Consequences of Viewing Strangers’ Instagram Posts","5","Instagram"
"897","Cultural Background and Measurement of Usage Moderate the Association Between Social Networking Sites (SNSs) Usage and Mental Health: A Meta-Analysis","20","Usage"
"901","A systematic review of the mental health outcomes associated with Facebook use","1","Facebook"
"907","Two faces of social comparison on Facebook: The interplay between social comparison orientation, emotions, and psychological well-being","1","Facebook"
"910","The Impact of Facebook on Social Comparison and Happiness: Evidence from a Natural Experiment","30","Impact"
"910","The Impact of Facebook on Social Comparison and Happiness: Evidence from a Natural Experiment","1","Facebook"
"914","Privacy-Aware personal Information Discovery model based on the cloud","59","Information"
"915","Passive and Active Facebook Use Measure (PAUM): Validation and relationship to the Reinforcement Sensitivity Theory","1","Facebook"
"915","Passive and Active Facebook Use Measure (PAUM): Validation and relationship to the Reinforcement Sensitivity Theory","21","Theory"
"917","Envy Sensitivity on Twitter and Facebook Among Japanese Young Adults","2","Twitter"
"917","Envy Sensitivity on Twitter and Facebook Among Japanese Young Adults","1","Facebook"
"921","The emotional responses of browsing Facebook","1","Facebook"
"922","The Impact of Facebookers’ Posts on Other Users’ Attitudes According to Their Age and Gender: Evidence from Al Ain University of Science and Technology","30","Impact"
"924","Facebook use and sleep quality: light interacts with socially induced alertness","1","Facebook"
"925","Facebook and Happiness: Life in a Frame","1","Facebook"
"926","Lurking and L2 learners on a Facebook group: the voices of the invisibles","1","Facebook"
"927","Fear of Missing Out as a Predictor of Problematic Social Media Use and Phubbing Behavior among Flemish Adolescents","39","Behavior"
"929","Snap, Tweet and Post: College Student Social Media Perceptions and Heutagogic Practices and Uses","72","Tweet"
"929","Snap, Tweet and Post: College Student Social Media Perceptions and Heutagogic Practices and Uses","48","Uses"
"930","Perceptions of Perfection: The Influence of Social Media on Interpersonal Evaluations","31","Influence"
"931","Social Network Sites, Individual Social Capital and Happiness","28","Network"
"934","Personality Traits, Motivations, and Emotional Consequences of Social Media Usage","20","Usage"
"935","Lise Öğrencilerinin Sosyal Ağ Siteleri Kullanımının Mutluluk, Psikolojik İyi-Oluş ve Yaşam Doyumlarına Etkisi: Facebook ve Twitter Örneği","1","Facebook"
"935","Lise Öğrencilerinin Sosyal Ağ Siteleri Kullanımının Mutluluk, Psikolojik İyi-Oluş ve Yaşam Doyumlarına Etkisi: Facebook ve Twitter Örneği","2","Twitter"
"938","Facebook Addiction Disorder (FAD) among German students—A longitudinal approach","1","Facebook"
"939","Time Spent on Social Network Sites and Psychological Well-Being: A Meta-Analysis","28","Network"
"941","Insights from an expressive writing intervention on Facebook to help alleviate depressive symptoms","1","Facebook"
"942","The effects of social media on students' behaviors; Facebook as a case study","1","Facebook"
"943","Millennials and the normalization of surveillance on Facebook","1","Facebook"
"944","Focusing on others before you shop: exposure to Facebook promotes conventional product configurations","1","Facebook"
"946","""Transformation Tuesday"": Temporal Context and Post Valence Influence the Provision of Social Support on Social Media","31","Influence"
"947","The Long Arm of the Digital Tether: Communication with Home during Study Abroad.","68","Digital"
"948","What triggers envy on Social Network Sites? A comparison between shared experiential and material purchases","28","Network"
"950","Do Social Network Sites Enhance or Undermine Subjective Well‐Being? A Critical Review","28","Network"
"955","The impact of Facebook and smart phone usage on the leisure activities and college adjustment of students in Serbia","1","Facebook"
"956","Content Management and Hashtag Recommendation in a P2P Social Networking Application","14","Content"
"956","Content Management and Hashtag Recommendation in a P2P Social Networking Application","25","Management"
"956","Content Management and Hashtag Recommendation in a P2P Social Networking Application","12","Hashtag"
"959","Relationship between High School Students' Facebook Addiction and Loneliness Status.","24","Relationship"
"959","Relationship between High School Students' Facebook Addiction and Loneliness Status.","1","Facebook"
"960","The Facebook Experiment: Quitting Facebook Leads to Higher Levels of Well-Being","1","Facebook"
"961","Reducing Risk for Mental Health Conditions Associated with Social Media Use: Encouraging “REAL” Communication","43","Risk"
"961","Reducing Risk for Mental Health Conditions Associated with Social Media Use: Encouraging “REAL” Communication","63","Health"
"963","Well-being and problematic Facebook use","1","Facebook"
"964","Do Our Facebook Friends Make Us Feel Worse? A Study of Social Comparison and Emotion","1","Facebook"
"965","Feelings on Facebook and their correlates with psychological well-being: The moderating role of culture","1","Facebook"
"966","Psychological effects of Facebook use : links between intensity of Facebook use, envy, loneliness and FoMO","1","Facebook"
"967","Rotating Online Behavior Change Interventions Increases Effectiveness But Also Increases Attrition","39","Behavior"
"970","Examining college students' uptake of Facebook through the lens of domestication theory:","1","Facebook"
"971","The Impact of Social Media on Social Comparison and Envy in Teenagers: The Moderating Role of the Parent Comparing Children and In-group Competition among Friends","30","Impact"
"972","Facebook users’ loneliness based on different types of interpersonal relationships: Links to grandiosity and envy","1","Facebook"
"973","Need for Containment as a Motivation for Facebook Use","1","Facebook"
"975","Is there any 'Facebook depression'? Exploring the moderating roles of neuroticism, Facebook social comparison and envy","1","Facebook"
"981","[book chapter]The Neuroscience of Smartphone/Social Media Usage and the Growing Need to Include Methods from ‘Psychoinformatics’","20","Usage"
"982","Do You “Like” Me?: Reassurance Seeking on Facebook and Depression","1","Facebook"
"983","Instagram Use, Loneliness, and Social Comparison Orientation: Interact and Browse on Social Media, But Don't Compare","5","Instagram"
"985","Mining the social mediome.","61","Mining"
"989","Information Disclosure and Control on Facebook: Are They Two Sides of the Same Coin or Two Different Processes?","59","Information"
"990","The Relationship among Young Adult College Students’ Depression, Anxiety, Stress, Demographics, Life Satisfaction, and Coping Styles","24","Relationship"
"994","Whose Space? Differences Among Users and Non-Users of Social Network Sites","28","Network"
"995","“Facebook Depression?” Social Networking Site Use and Depression in Older Adolescents","17","Site"
"996","Identity construction on Facebook","1","Facebook"
"997","The relationship between frequency of Facebook use, participation in Facebook activities, and student engagement","1","Facebook"
"1000","Attitudes Toward Online Social Connection and Self-Disclosure as Predictors of Facebook Communication and Relational Closeness","1","Facebook"
"1002","Mirror, Mirror on my Facebook Wall: Effects of Exposure to Facebook on Self-Esteem","1","Facebook"
"1003","The links that bind: Uncovering novel motivations for linking on Facebook","1","Facebook"
"1004","Let Users Generate Your Video Ads? The Impact of Video Source and Quality on Consumers' Perceptions and Intended Behaviors","30","Impact"
"1005","Clinical Report—The Impact of Social Media on Children, Adolescents, and Families","30","Impact"
"1012","Facebook and Online Privacy: Attitudes, Behaviors, and Unintended Consequences","1","Facebook"
"1013","The Real You? The Role of Visual Cues and Comment Congruence in Perceptions of Social Attractiveness from Facebook Profiles","1","Facebook"
"1015","Who's Posting Facebook Faux Pas? A Cross-Cultural Examination of Personality Differences","1","Facebook"
"1016","Communication Competence, Social Support, and Depression Among College Students: A Model of Facebook and Face-to-Face Support Network Influence","1","Facebook"
"1016","Communication Competence, Social Support, and Depression Among College Students: A Model of Facebook and Face-to-Face Support Network Influence","28","Network"
"1016","Communication Competence, Social Support, and Depression Among College Students: A Model of Facebook and Face-to-Face Support Network Influence","31","Influence"
"1017","Peer Status in Emerging Adulthood: Associations of Popularity and Preference With Social Roles and Behavior","39","Behavior"
"1019","Who does what on Facebook? Age, sex, and relationship status as predictors of Facebook use","1","Facebook"
"1020","Imagining Twitter as an Imagined Community","2","Twitter"
"1022","The Benefits of Facebook ''Friends:'' Social Capital and College Students' Use of Online Social Network Sites","1","Facebook"
"1022","The Benefits of Facebook ''Friends:'' Social Capital and College Students' Use of Online Social Network Sites","28","Network"
"1023","Uses and Gratifications of Social Media: A Comparison of Facebook and Instant Messaging","48","Uses"
"1023","Uses and Gratifications of Social Media: A Comparison of Facebook and Instant Messaging","1","Facebook"
"1026","Facebook as a toolkit: A uses and gratification approach to unbundling feature use","1","Facebook"
"1028","Personality and motivations associated with Facebook use","1","Facebook"
"1029","“They Are Happier and Having Better Lives than I Am”: The Impact of Using Facebook on Perceptions of Others' Lives","30","Impact"
"1029","“They Are Happier and Having Better Lives than I Am”: The Impact of Using Facebook on Perceptions of Others' Lives","1","Facebook"
"1031","News sharing in social media: The effect of gratifications and prior experience","38","News"
"1032","Mood Effects of Televised Sports Events The Impact of FIFA World Cups on Viewers’ Mood and Judgments","30","Impact"
"1039","The Facebook Paths to Happiness: Effects of the Number of Facebook Friends and Self-Presentation on Subjective Well-Being","1","Facebook"
"1044","Self-Generated Versus Other-Generated Statements and Impressions in Computer-Mediated Communication A Test of Warranting Theory Using Facebook","21","Theory"
"1044","Self-Generated Versus Other-Generated Statements and Impressions in Computer-Mediated Communication A Test of Warranting Theory Using Facebook","1","Facebook"
"1047","[book]Mass Communication Research and Theory","21","Theory"
"1054","Audit Committee Interlocks and the Contagion of Accrual-Based and Real Earnings Management","25","Management"
"1058","Board Interlocks and Earnings Management Contagion","25","Management"
"1065","Agents without Principles? the Spread of the Poison Pill through the Intercorporate Network","28","Network"
"1069","How Do Regulatory Reforms to Enhance Auditor Independence Work in Practice","22","Practice"
"1079","Former Audit Firm Personnel as CFOs: Effect on Earnings Management","25","Management"
"1082","The Audit Committee: Management Watchdog or Personal Friend of the CEO?","25","Management"
"1084","Auditor Concentration And The Impact Of Interlocking Directorates","30","Impact"
"1091","The Impact of Board Interlocks on Auditor Choice and Audit Fees","30","Impact"
"1093","Auditor Switches in the Pre‐ and Post‐Enron Eras: Risk or Realignment?","43","Risk"
"1098","The Impact of Scale and Scope on Global University Rankings: What We Know and What We Need to Learn","30","Impact"
"1122","[book]Economics of Distance and Online Learning: Theory, Practice and Research","22","Practice"
"1137","Analysis of Diurnal and Seasonal Behavior of Surface Ozone and Its Precursors (NOx) at a Semi-Arid Rural Site in Southern India","39","Behavior"
"1137","Analysis of Diurnal and Seasonal Behavior of Surface Ozone and Its Precursors (NOx) at a Semi-Arid Rural Site in Southern India","17","Site"
"1143","Air Pollution, the Automobile, and Public Health","63","Health"
"1158","Health Effects of Ozone","63","Health"
"1163","Long-Term Ozone Exposure and Mortality","76","Data"
"1176","Simulating the Social Dynamics of Spatial Disparity Through Neighborhood Network Evolution","28","Network"
"1182","Friendship Networks Through Time: An Actor-Oriented Dynamic Statistical Network Model","28","Network"
"1184","Network analysis and social dynamics","28","Network"
